{
  "$schema": "./schemas/framework.config.schema.json",
  "projectName": "my-app",
  "harnesses": ["claude-code"],
  "orm": "drizzle",
  "ui": null,
  "stack": "generic-node",
  "paths": {
    "modulesRoot": "src/modules",
    "specsRoot": ".ai/specs",
    "testsRoot": ".ai/qa/tests"
  },
  "validation": ["npm run typecheck", "npm test"],
  "git": {
    "defaultBranch": "main",
    "labels": []
  },
  "source": {
    "path": null,
    "repo": "git@github.com:zizzfizzix/agentic-engineering-framework.git"
  },
  "feedback": {
    "enabled": false,
    "channel": "issue",
    "sanitize": true
  }
}
